No.     Time           Source                Destination           Protocol Length Info
      1 0.000000000    192.168.1.104         141.212.109.161       TLSv1    752    Application Data, Application Data

Frame 1: 752 bytes on wire (6016 bits), 752 bytes captured (6016 bits) on interface 0
    Interface id: 0
    Encapsulation type: Ethernet (1)
    Arrival Time: Apr  7, 2014 17:00:57.921691000 Eastern Daylight Time
    [Time shift for this packet: 0.000000000 seconds]
    Epoch Time: 1396904457.921691000 seconds
    [Time delta from previous captured frame: 0.000000000 seconds]
    [Time delta from previous displayed frame: 0.000000000 seconds]
    [Time since reference or first frame: 0.000000000 seconds]
    Frame Number: 1
    Frame Length: 752 bytes (6016 bits)
    Capture Length: 752 bytes (6016 bits)
    [Frame is marked: False]
    [Frame is ignored: False]
    [Protocols in frame: eth:ip:tcp:ssl]
    [Coloring Rule Name: TCP]
    [Coloring Rule String: tcp]
Ethernet II, Src: Hewlett-_97:fd:09 (1c:c1:de:97:fd:09), Dst: Vmware_7f:e3:53 (00:0c:29:7f:e3:53)
    Destination: Vmware_7f:e3:53 (00:0c:29:7f:e3:53)
        Address: Vmware_7f:e3:53 (00:0c:29:7f:e3:53)
        .... ..0. .... .... .... .... = LG bit: Globally unique address (factory default)
        .... ...0 .... .... .... .... = IG bit: Individual address (unicast)
    Source: Hewlett-_97:fd:09 (1c:c1:de:97:fd:09)
        Address: Hewlett-_97:fd:09 (1c:c1:de:97:fd:09)
        .... ..0. .... .... .... .... = LG bit: Globally unique address (factory default)
        .... ...0 .... .... .... .... = IG bit: Individual address (unicast)
    Type: IP (0x0800)
Internet Protocol Version 4, Src: 192.168.1.104 (192.168.1.104), Dst: 141.212.109.161 (141.212.109.161)
    Version: 4
    Header length: 20 bytes
    Differentiated Services Field: 0x00 (DSCP 0x00: Default; ECN: 0x00: Not-ECT (Not ECN-Capable Transport))
        0000 00.. = Differentiated Services Codepoint: Default (0x00)
        .... ..00 = Explicit Congestion Notification: Not-ECT (Not ECN-Capable Transport) (0x00)
    Total Length: 738
    Identification: 0x0266 (614)
    Flags: 0x02 (Don't Fragment)
        0... .... = Reserved bit: Not set
        .1.. .... = Don't fragment: Set
        ..0. .... = More fragments: Not set
    Fragment offset: 0
    Time to live: 128
    Protocol: TCP (6)
    Header checksum: 0x382a [validation disabled]
        [Good: False]
        [Bad: False]
    Source: 192.168.1.104 (192.168.1.104)
    Destination: 141.212.109.161 (141.212.109.161)
    [Source GeoIP: Unknown]
    [Destination GeoIP: Unknown]
Transmission Control Protocol, Src Port: 49359 (49359), Dst Port: https (443), Seq: 1, Ack: 1, Len: 698
    Source port: 49359 (49359)
    Destination port: https (443)
    [Stream index: 0]
    Sequence number: 1    (relative sequence number)
    [Next sequence number: 699    (relative sequence number)]
    Acknowledgment number: 1    (relative ack number)
    Header length: 20 bytes
    Flags: 0x018 (PSH, ACK)
        000. .... .... = Reserved: Not set
        ...0 .... .... = Nonce: Not set
        .... 0... .... = Congestion Window Reduced (CWR): Not set
        .... .0.. .... = ECN-Echo: Not set
        .... ..0. .... = Urgent: Not set
        .... ...1 .... = Acknowledgment: Set
        .... .... 1... = Push: Set
        .... .... .0.. = Reset: Not set
        .... .... ..0. = Syn: Not set
        .... .... ...0 = Fin: Not set
    Window size value: 16342
    [Calculated window size: 16342]
    [Window size scaling factor: -1 (unknown)]
    Checksum: 0x1290 [validation disabled]
        [Good Checksum: False]
        [Bad Checksum: False]
    [SEQ/ACK analysis]
        [Bytes in flight: 698]
Secure Sockets Layer
    TLSv1 Record Layer: Application Data Protocol: http
        Content Type: Application Data (23)
        Version: TLS 1.0 (0x0301)
        Length: 32
        Encrypted Application Data: a7223b8c198c264c224268de3facf1332e6e12c8c064c7fa...
    TLSv1 Record Layer: Application Data Protocol: http
        Content Type: Application Data (23)
        Version: TLS 1.0 (0x0301)
        Length: 656
        Encrypted Application Data: 9dce34fee57a0c10ef4299afb9a294471c1c5d8ab541c902...

No.     Time           Source                Destination           Protocol Length Info
      2 0.012984000    141.212.109.161       192.168.1.104         TCP      60     https > 49359 [ACK] Seq=1 Ack=699 Win=16019 Len=0

Frame 2: 60 bytes on wire (480 bits), 60 bytes captured (480 bits) on interface 0
    Interface id: 0
    Encapsulation type: Ethernet (1)
    Arrival Time: Apr  7, 2014 17:00:57.934675000 Eastern Daylight Time
    [Time shift for this packet: 0.000000000 seconds]
    Epoch Time: 1396904457.934675000 seconds
    [Time delta from previous captured frame: 0.012984000 seconds]
    [Time delta from previous displayed frame: 0.012984000 seconds]
    [Time since reference or first frame: 0.012984000 seconds]
    Frame Number: 2
    Frame Length: 60 bytes (480 bits)
    Capture Length: 60 bytes (480 bits)
    [Frame is marked: False]
    [Frame is ignored: False]
    [Protocols in frame: eth:ip:tcp]
    [Coloring Rule Name: TCP]
    [Coloring Rule String: tcp]
Ethernet II, Src: Vmware_7f:e3:53 (00:0c:29:7f:e3:53), Dst: Hewlett-_97:fd:09 (1c:c1:de:97:fd:09)
    Destination: Hewlett-_97:fd:09 (1c:c1:de:97:fd:09)
        Address: Hewlett-_97:fd:09 (1c:c1:de:97:fd:09)
        .... ..0. .... .... .... .... = LG bit: Globally unique address (factory default)
        .... ...0 .... .... .... .... = IG bit: Individual address (unicast)
    Source: Vmware_7f:e3:53 (00:0c:29:7f:e3:53)
        Address: Vmware_7f:e3:53 (00:0c:29:7f:e3:53)
        .... ..0. .... .... .... .... = LG bit: Globally unique address (factory default)
        .... ...0 .... .... .... .... = IG bit: Individual address (unicast)
    Type: IP (0x0800)
    Padding: 000000000000
Internet Protocol Version 4, Src: 141.212.109.161 (141.212.109.161), Dst: 192.168.1.104 (192.168.1.104)
    Version: 4
    Header length: 20 bytes
    Differentiated Services Field: 0x00 (DSCP 0x00: Default; ECN: 0x00: Not-ECT (Not ECN-Capable Transport))
        0000 00.. = Differentiated Services Codepoint: Default (0x00)
        .... ..00 = Explicit Congestion Notification: Not-ECT (Not ECN-Capable Transport) (0x00)
    Total Length: 40
    Identification: 0x14d1 (5329)
    Flags: 0x02 (Don't Fragment)
        0... .... = Reserved bit: Not set
        .1.. .... = Don't fragment: Set
        ..0. .... = More fragments: Not set
    Fragment offset: 0
    Time to live: 54
    Protocol: TCP (6)
    Header checksum: 0x7279 [validation disabled]
        [Good: False]
        [Bad: False]
    Source: 141.212.109.161 (141.212.109.161)
    Destination: 192.168.1.104 (192.168.1.104)
    [Source GeoIP: Unknown]
    [Destination GeoIP: Unknown]
Transmission Control Protocol, Src Port: https (443), Dst Port: 49359 (49359), Seq: 1, Ack: 699, Len: 0
    Source port: https (443)
    Destination port: 49359 (49359)
    [Stream index: 0]
    Sequence number: 1    (relative sequence number)
    Acknowledgment number: 699    (relative ack number)
    Header length: 20 bytes
    Flags: 0x010 (ACK)
        000. .... .... = Reserved: Not set
        ...0 .... .... = Nonce: Not set
        .... 0... .... = Congestion Window Reduced (CWR): Not set
        .... .0.. .... = ECN-Echo: Not set
        .... ..0. .... = Urgent: Not set
        .... ...1 .... = Acknowledgment: Set
        .... .... 0... = Push: Not set
        .... .... .0.. = Reset: Not set
        .... .... ..0. = Syn: Not set
        .... .... ...0 = Fin: Not set
    Window size value: 16019
    [Calculated window size: 16019]
    [Window size scaling factor: -1 (unknown)]
    Checksum: 0x4973 [validation disabled]
        [Good Checksum: False]
        [Bad Checksum: False]
    [SEQ/ACK analysis]
        [This is an ACK to the segment in frame: 1]
        [The RTT to ACK the segment was: 0.012984000 seconds]

No.     Time           Source                Destination           Protocol Length Info
      3 0.095092000    141.212.109.161       192.168.1.104         TLSv1    1514   Application Data

Frame 3: 1514 bytes on wire (12112 bits), 1514 bytes captured (12112 bits) on interface 0
    Interface id: 0
    Encapsulation type: Ethernet (1)
    Arrival Time: Apr  7, 2014 17:00:58.016783000 Eastern Daylight Time
    [Time shift for this packet: 0.000000000 seconds]
    Epoch Time: 1396904458.016783000 seconds
    [Time delta from previous captured frame: 0.082108000 seconds]
    [Time delta from previous displayed frame: 0.082108000 seconds]
    [Time since reference or first frame: 0.095092000 seconds]
    Frame Number: 3
    Frame Length: 1514 bytes (12112 bits)
    Capture Length: 1514 bytes (12112 bits)
    [Frame is marked: False]
    [Frame is ignored: False]
    [Protocols in frame: eth:ip:tcp:ssl]
    [Coloring Rule Name: TCP]
    [Coloring Rule String: tcp]
Ethernet II, Src: Vmware_7f:e3:53 (00:0c:29:7f:e3:53), Dst: Hewlett-_97:fd:09 (1c:c1:de:97:fd:09)
    Destination: Hewlett-_97:fd:09 (1c:c1:de:97:fd:09)
        Address: Hewlett-_97:fd:09 (1c:c1:de:97:fd:09)
        .... ..0. .... .... .... .... = LG bit: Globally unique address (factory default)
        .... ...0 .... .... .... .... = IG bit: Individual address (unicast)
    Source: Vmware_7f:e3:53 (00:0c:29:7f:e3:53)
        Address: Vmware_7f:e3:53 (00:0c:29:7f:e3:53)
        .... ..0. .... .... .... .... = LG bit: Globally unique address (factory default)
        .... ...0 .... .... .... .... = IG bit: Individual address (unicast)
    Type: IP (0x0800)
Internet Protocol Version 4, Src: 141.212.109.161 (141.212.109.161), Dst: 192.168.1.104 (192.168.1.104)
    Version: 4
    Header length: 20 bytes
    Differentiated Services Field: 0x00 (DSCP 0x00: Default; ECN: 0x00: Not-ECT (Not ECN-Capable Transport))
        0000 00.. = Differentiated Services Codepoint: Default (0x00)
        .... ..00 = Explicit Congestion Notification: Not-ECT (Not ECN-Capable Transport) (0x00)
    Total Length: 1500
    Identification: 0x14d2 (5330)
    Flags: 0x02 (Don't Fragment)
        0... .... = Reserved bit: Not set
        .1.. .... = Don't fragment: Set
        ..0. .... = More fragments: Not set
    Fragment offset: 0
    Time to live: 54
    Protocol: TCP (6)
    Header checksum: 0x6cc4 [validation disabled]
        [Good: False]
        [Bad: False]
    Source: 141.212.109.161 (141.212.109.161)
    Destination: 192.168.1.104 (192.168.1.104)
    [Source GeoIP: Unknown]
    [Destination GeoIP: Unknown]
Transmission Control Protocol, Src Port: https (443), Dst Port: 49359 (49359), Seq: 1, Ack: 699, Len: 1460
    Source port: https (443)
    Destination port: 49359 (49359)
    [Stream index: 0]
    Sequence number: 1    (relative sequence number)
    [Next sequence number: 1461    (relative sequence number)]
    Acknowledgment number: 699    (relative ack number)
    Header length: 20 bytes
    Flags: 0x010 (ACK)
        000. .... .... = Reserved: Not set
        ...0 .... .... = Nonce: Not set
        .... 0... .... = Congestion Window Reduced (CWR): Not set
        .... .0.. .... = ECN-Echo: Not set
        .... ..0. .... = Urgent: Not set
        .... ...1 .... = Acknowledgment: Set
        .... .... 0... = Push: Not set
        .... .... .0.. = Reset: Not set
        .... .... ..0. = Syn: Not set
        .... .... ...0 = Fin: Not set
    Window size value: 16019
    [Calculated window size: 16019]
    [Window size scaling factor: -1 (unknown)]
    Checksum: 0x55cb [validation disabled]
        [Good Checksum: False]
        [Bad Checksum: False]
    [SEQ/ACK analysis]
        [Bytes in flight: 1460]
    TCP segment data (1423 bytes)
Secure Sockets Layer
    TLSv1 Record Layer: Application Data Protocol: http
        Content Type: Application Data (23)
        Version: TLS 1.0 (0x0301)
        Length: 32
        Encrypted Application Data: 771932687e1679d2ef131e6e0c9d9e50f3103c6bc1f93dd7...

No.     Time           Source                Destination           Protocol Length Info
      4 0.095384000    141.212.109.161       192.168.1.104         TLSv1    76     Application Data

Frame 4: 76 bytes on wire (608 bits), 76 bytes captured (608 bits) on interface 0
    Interface id: 0
    Encapsulation type: Ethernet (1)
    Arrival Time: Apr  7, 2014 17:00:58.017075000 Eastern Daylight Time
    [Time shift for this packet: 0.000000000 seconds]
    Epoch Time: 1396904458.017075000 seconds
    [Time delta from previous captured frame: 0.000292000 seconds]
    [Time delta from previous displayed frame: 0.000292000 seconds]
    [Time since reference or first frame: 0.095384000 seconds]
    Frame Number: 4
    Frame Length: 76 bytes (608 bits)
    Capture Length: 76 bytes (608 bits)
    [Frame is marked: False]
    [Frame is ignored: False]
    [Protocols in frame: eth:ip:tcp:ssl]
    [Coloring Rule Name: TCP]
    [Coloring Rule String: tcp]
Ethernet II, Src: Vmware_7f:e3:53 (00:0c:29:7f:e3:53), Dst: Hewlett-_97:fd:09 (1c:c1:de:97:fd:09)
    Destination: Hewlett-_97:fd:09 (1c:c1:de:97:fd:09)
        Address: Hewlett-_97:fd:09 (1c:c1:de:97:fd:09)
        .... ..0. .... .... .... .... = LG bit: Globally unique address (factory default)
        .... ...0 .... .... .... .... = IG bit: Individual address (unicast)
    Source: Vmware_7f:e3:53 (00:0c:29:7f:e3:53)
        Address: Vmware_7f:e3:53 (00:0c:29:7f:e3:53)
        .... ..0. .... .... .... .... = LG bit: Globally unique address (factory default)
        .... ...0 .... .... .... .... = IG bit: Individual address (unicast)
    Type: IP (0x0800)
Internet Protocol Version 4, Src: 141.212.109.161 (141.212.109.161), Dst: 192.168.1.104 (192.168.1.104)
    Version: 4
    Header length: 20 bytes
    Differentiated Services Field: 0x00 (DSCP 0x00: Default; ECN: 0x00: Not-ECT (Not ECN-Capable Transport))
        0000 00.. = Differentiated Services Codepoint: Default (0x00)
        .... ..00 = Explicit Congestion Notification: Not-ECT (Not ECN-Capable Transport) (0x00)
    Total Length: 62
    Identification: 0x14d3 (5331)
    Flags: 0x02 (Don't Fragment)
        0... .... = Reserved bit: Not set
        .1.. .... = Don't fragment: Set
        ..0. .... = More fragments: Not set
    Fragment offset: 0
    Time to live: 54
    Protocol: TCP (6)
    Header checksum: 0x7261 [validation disabled]
        [Good: False]
        [Bad: False]
    Source: 141.212.109.161 (141.212.109.161)
    Destination: 192.168.1.104 (192.168.1.104)
    [Source GeoIP: Unknown]
    [Destination GeoIP: Unknown]
Transmission Control Protocol, Src Port: https (443), Dst Port: 49359 (49359), Seq: 1461, Ack: 699, Len: 22
    Source port: https (443)
    Destination port: 49359 (49359)
    [Stream index: 0]
    Sequence number: 1461    (relative sequence number)
    [Next sequence number: 1483    (relative sequence number)]
    Acknowledgment number: 699    (relative ack number)
    Header length: 20 bytes
    Flags: 0x018 (PSH, ACK)
        000. .... .... = Reserved: Not set
        ...0 .... .... = Nonce: Not set
        .... 0... .... = Congestion Window Reduced (CWR): Not set
        .... .0.. .... = ECN-Echo: Not set
        .... ..0. .... = Urgent: Not set
        .... ...1 .... = Acknowledgment: Set
        .... .... 1... = Push: Set
        .... .... .0.. = Reset: Not set
        .... .... ..0. = Syn: Not set
        .... .... ...0 = Fin: Not set
    Window size value: 16019
    [Calculated window size: 16019]
    [Window size scaling factor: -1 (unknown)]
    Checksum: 0x57e9 [validation disabled]
        [Good Checksum: False]
        [Bad Checksum: False]
    [SEQ/ACK analysis]
        [Bytes in flight: 1482]
    TCP segment data (22 bytes)
[2 Reassembled TCP Segments (1445 bytes): #3(1423), #4(22)]
    [Frame: 3, payload: 0-1422 (1423 bytes)]
    [Frame: 4, payload: 1423-1444 (22 bytes)]
    [Segment count: 2]
    [Reassembled TCP length: 1445]
    [Reassembled TCP Data: 17030105a05b9f7420082c9ae635535b5bb9a698a1c6dc21...]
Secure Sockets Layer
    TLSv1 Record Layer: Application Data Protocol: http
        Content Type: Application Data (23)
        Version: TLS 1.0 (0x0301)
        Length: 1440
        Encrypted Application Data: 5b9f7420082c9ae635535b5bb9a698a1c6dc21be098ad328...

No.     Time           Source                Destination           Protocol Length Info
      5 0.095424000    192.168.1.104         141.212.109.161       TCP      54     49359 > https [ACK] Seq=699 Ack=1483 Win=16425 Len=0

Frame 5: 54 bytes on wire (432 bits), 54 bytes captured (432 bits) on interface 0
    Interface id: 0
    Encapsulation type: Ethernet (1)
    Arrival Time: Apr  7, 2014 17:00:58.017115000 Eastern Daylight Time
    [Time shift for this packet: 0.000000000 seconds]
    Epoch Time: 1396904458.017115000 seconds
    [Time delta from previous captured frame: 0.000040000 seconds]
    [Time delta from previous displayed frame: 0.000040000 seconds]
    [Time since reference or first frame: 0.095424000 seconds]
    Frame Number: 5
    Frame Length: 54 bytes (432 bits)
    Capture Length: 54 bytes (432 bits)
    [Frame is marked: False]
    [Frame is ignored: False]
    [Protocols in frame: eth:ip:tcp]
    [Coloring Rule Name: TCP]
    [Coloring Rule String: tcp]
Ethernet II, Src: Hewlett-_97:fd:09 (1c:c1:de:97:fd:09), Dst: Vmware_7f:e3:53 (00:0c:29:7f:e3:53)
    Destination: Vmware_7f:e3:53 (00:0c:29:7f:e3:53)
        Address: Vmware_7f:e3:53 (00:0c:29:7f:e3:53)
        .... ..0. .... .... .... .... = LG bit: Globally unique address (factory default)
        .... ...0 .... .... .... .... = IG bit: Individual address (unicast)
    Source: Hewlett-_97:fd:09 (1c:c1:de:97:fd:09)
        Address: Hewlett-_97:fd:09 (1c:c1:de:97:fd:09)
        .... ..0. .... .... .... .... = LG bit: Globally unique address (factory default)
        .... ...0 .... .... .... .... = IG bit: Individual address (unicast)
    Type: IP (0x0800)
Internet Protocol Version 4, Src: 192.168.1.104 (192.168.1.104), Dst: 141.212.109.161 (141.212.109.161)
    Version: 4
    Header length: 20 bytes
    Differentiated Services Field: 0x00 (DSCP 0x00: Default; ECN: 0x00: Not-ECT (Not ECN-Capable Transport))
        0000 00.. = Differentiated Services Codepoint: Default (0x00)
        .... ..00 = Explicit Congestion Notification: Not-ECT (Not ECN-Capable Transport) (0x00)
    Total Length: 40
    Identification: 0x0267 (615)
    Flags: 0x02 (Don't Fragment)
        0... .... = Reserved bit: Not set
        .1.. .... = Don't fragment: Set
        ..0. .... = More fragments: Not set
    Fragment offset: 0
    Time to live: 128
    Protocol: TCP (6)
    Header checksum: 0x3ae3 [validation disabled]
        [Good: False]
        [Bad: False]
    Source: 192.168.1.104 (192.168.1.104)
    Destination: 141.212.109.161 (141.212.109.161)
    [Source GeoIP: Unknown]
    [Destination GeoIP: Unknown]
Transmission Control Protocol, Src Port: 49359 (49359), Dst Port: https (443), Seq: 699, Ack: 1483, Len: 0
    Source port: 49359 (49359)
    Destination port: https (443)
    [Stream index: 0]
    Sequence number: 699    (relative sequence number)
    Acknowledgment number: 1483    (relative ack number)
    Header length: 20 bytes
    Flags: 0x010 (ACK)
        000. .... .... = Reserved: Not set
        ...0 .... .... = Nonce: Not set
        .... 0... .... = Congestion Window Reduced (CWR): Not set
        .... .0.. .... = ECN-Echo: Not set
        .... ..0. .... = Urgent: Not set
        .... ...1 .... = Acknowledgment: Set
        .... .... 0... = Push: Not set
        .... .... .0.. = Reset: Not set
        .... .... ..0. = Syn: Not set
        .... .... ...0 = Fin: Not set
    Window size value: 16425
    [Calculated window size: 16425]
    [Window size scaling factor: -1 (unknown)]
    Checksum: 0x4213 [validation disabled]
        [Good Checksum: False]
        [Bad Checksum: False]
    [SEQ/ACK analysis]
        [This is an ACK to the segment in frame: 4]
        [The RTT to ACK the segment was: 0.000040000 seconds]

No.     Time           Source                Destination           Protocol Length Info
      6 0.108517000    141.212.109.161       192.168.1.104         TLSv1    1514   Application Data

Frame 6: 1514 bytes on wire (12112 bits), 1514 bytes captured (12112 bits) on interface 0
    Interface id: 0
    Encapsulation type: Ethernet (1)
    Arrival Time: Apr  7, 2014 17:00:58.030208000 Eastern Daylight Time
    [Time shift for this packet: 0.000000000 seconds]
    Epoch Time: 1396904458.030208000 seconds
    [Time delta from previous captured frame: 0.013093000 seconds]
    [Time delta from previous displayed frame: 0.013093000 seconds]
    [Time since reference or first frame: 0.108517000 seconds]
    Frame Number: 6
    Frame Length: 1514 bytes (12112 bits)
    Capture Length: 1514 bytes (12112 bits)
    [Frame is marked: False]
    [Frame is ignored: False]
    [Protocols in frame: eth:ip:tcp:ssl]
    [Coloring Rule Name: TCP]
    [Coloring Rule String: tcp]
Ethernet II, Src: Vmware_7f:e3:53 (00:0c:29:7f:e3:53), Dst: Hewlett-_97:fd:09 (1c:c1:de:97:fd:09)
    Destination: Hewlett-_97:fd:09 (1c:c1:de:97:fd:09)
        Address: Hewlett-_97:fd:09 (1c:c1:de:97:fd:09)
        .... ..0. .... .... .... .... = LG bit: Globally unique address (factory default)
        .... ...0 .... .... .... .... = IG bit: Individual address (unicast)
    Source: Vmware_7f:e3:53 (00:0c:29:7f:e3:53)
        Address: Vmware_7f:e3:53 (00:0c:29:7f:e3:53)
        .... ..0. .... .... .... .... = LG bit: Globally unique address (factory default)
        .... ...0 .... .... .... .... = IG bit: Individual address (unicast)
    Type: IP (0x0800)
Internet Protocol Version 4, Src: 141.212.109.161 (141.212.109.161), Dst: 192.168.1.104 (192.168.1.104)
    Version: 4
    Header length: 20 bytes
    Differentiated Services Field: 0x00 (DSCP 0x00: Default; ECN: 0x00: Not-ECT (Not ECN-Capable Transport))
        0000 00.. = Differentiated Services Codepoint: Default (0x00)
        .... ..00 = Explicit Congestion Notification: Not-ECT (Not ECN-Capable Transport) (0x00)
    Total Length: 1500
    Identification: 0x14d4 (5332)
    Flags: 0x02 (Don't Fragment)
        0... .... = Reserved bit: Not set
        .1.. .... = Don't fragment: Set
        ..0. .... = More fragments: Not set
    Fragment offset: 0
    Time to live: 54
    Protocol: TCP (6)
    Header checksum: 0x6cc2 [validation disabled]
        [Good: False]
        [Bad: False]
    Source: 141.212.109.161 (141.212.109.161)
    Destination: 192.168.1.104 (192.168.1.104)
    [Source GeoIP: Unknown]
    [Destination GeoIP: Unknown]
Transmission Control Protocol, Src Port: https (443), Dst Port: 49359 (49359), Seq: 1483, Ack: 699, Len: 1460
    Source port: https (443)
    Destination port: 49359 (49359)
    [Stream index: 0]
    Sequence number: 1483    (relative sequence number)
    [Next sequence number: 2943    (relative sequence number)]
    Acknowledgment number: 699    (relative ack number)
    Header length: 20 bytes
    Flags: 0x010 (ACK)
        000. .... .... = Reserved: Not set
        ...0 .... .... = Nonce: Not set
        .... 0... .... = Congestion Window Reduced (CWR): Not set
        .... .0.. .... = ECN-Echo: Not set
        .... ..0. .... = Urgent: Not set
        .... ...1 .... = Acknowledgment: Set
        .... .... 0... = Push: Not set
        .... .... .0.. = Reset: Not set
        .... .... ..0. = Syn: Not set
        .... .... ...0 = Fin: Not set
    Window size value: 16019
    [Calculated window size: 16019]
    [Window size scaling factor: -1 (unknown)]
    Checksum: 0xb1c8 [validation disabled]
        [Good Checksum: False]
        [Bad Checksum: False]
    [SEQ/ACK analysis]
        [Bytes in flight: 1460]
    TCP segment data (1423 bytes)
Secure Sockets Layer
    TLSv1 Record Layer: Application Data Protocol: http
        Content Type: Application Data (23)
        Version: TLS 1.0 (0x0301)
        Length: 32
        Encrypted Application Data: 8f4a567647acad26766c3ab2844cead2efae5d5456742c44...

No.     Time           Source                Destination           Protocol Length Info
      7 0.108566000    141.212.109.161       192.168.1.104         TCP      1514   [TCP segment of a reassembled PDU]

Frame 7: 1514 bytes on wire (12112 bits), 1514 bytes captured (12112 bits) on interface 0
    Interface id: 0
    Encapsulation type: Ethernet (1)
    Arrival Time: Apr  7, 2014 17:00:58.030257000 Eastern Daylight Time
    [Time shift for this packet: 0.000000000 seconds]
    Epoch Time: 1396904458.030257000 seconds
    [Time delta from previous captured frame: 0.000049000 seconds]
    [Time delta from previous displayed frame: 0.000049000 seconds]
    [Time since reference or first frame: 0.108566000 seconds]
    Frame Number: 7
    Frame Length: 1514 bytes (12112 bits)
    Capture Length: 1514 bytes (12112 bits)
    [Frame is marked: False]
    [Frame is ignored: False]
    [Protocols in frame: eth:ip:tcp]
    [Coloring Rule Name: TCP]
    [Coloring Rule String: tcp]
Ethernet II, Src: Vmware_7f:e3:53 (00:0c:29:7f:e3:53), Dst: Hewlett-_97:fd:09 (1c:c1:de:97:fd:09)
    Destination: Hewlett-_97:fd:09 (1c:c1:de:97:fd:09)
        Address: Hewlett-_97:fd:09 (1c:c1:de:97:fd:09)
        .... ..0. .... .... .... .... = LG bit: Globally unique address (factory default)
        .... ...0 .... .... .... .... = IG bit: Individual address (unicast)
    Source: Vmware_7f:e3:53 (00:0c:29:7f:e3:53)
        Address: Vmware_7f:e3:53 (00:0c:29:7f:e3:53)
        .... ..0. .... .... .... .... = LG bit: Globally unique address (factory default)
        .... ...0 .... .... .... .... = IG bit: Individual address (unicast)
    Type: IP (0x0800)
Internet Protocol Version 4, Src: 141.212.109.161 (141.212.109.161), Dst: 192.168.1.104 (192.168.1.104)
    Version: 4
    Header length: 20 bytes
    Differentiated Services Field: 0x00 (DSCP 0x00: Default; ECN: 0x00: Not-ECT (Not ECN-Capable Transport))
        0000 00.. = Differentiated Services Codepoint: Default (0x00)
        .... ..00 = Explicit Congestion Notification: Not-ECT (Not ECN-Capable Transport) (0x00)
    Total Length: 1500
    Identification: 0x14d5 (5333)
    Flags: 0x02 (Don't Fragment)
        0... .... = Reserved bit: Not set
        .1.. .... = Don't fragment: Set
        ..0. .... = More fragments: Not set
    Fragment offset: 0
    Time to live: 54
    Protocol: TCP (6)
    Header checksum: 0x6cc1 [validation disabled]
        [Good: False]
        [Bad: False]
    Source: 141.212.109.161 (141.212.109.161)
    Destination: 192.168.1.104 (192.168.1.104)
    [Source GeoIP: Unknown]
    [Destination GeoIP: Unknown]
Transmission Control Protocol, Src Port: https (443), Dst Port: 49359 (49359), Seq: 2943, Ack: 699, Len: 1460
    Source port: https (443)
    Destination port: 49359 (49359)
    [Stream index: 0]
    Sequence number: 2943    (relative sequence number)
    [Next sequence number: 4403    (relative sequence number)]
    Acknowledgment number: 699    (relative ack number)
    Header length: 20 bytes
    Flags: 0x010 (ACK)
        000. .... .... = Reserved: Not set
        ...0 .... .... = Nonce: Not set
        .... 0... .... = Congestion Window Reduced (CWR): Not set
        .... .0.. .... = ECN-Echo: Not set
        .... ..0. .... = Urgent: Not set
        .... ...1 .... = Acknowledgment: Set
        .... .... 0... = Push: Not set
        .... .... .0.. = Reset: Not set
        .... .... ..0. = Syn: Not set
        .... .... ...0 = Fin: Not set
    Window size value: 16019
    [Calculated window size: 16019]
    [Window size scaling factor: -1 (unknown)]
    Checksum: 0x06f8 [validation disabled]
        [Good Checksum: False]
        [Bad Checksum: False]
    [SEQ/ACK analysis]
        [Bytes in flight: 2920]
    [Reassembled PDU in frame: 9]
    TCP segment data (1460 bytes)

No.     Time           Source                Destination           Protocol Length Info
      8 0.108594000    192.168.1.104         141.212.109.161       TCP      54     49359 > https [ACK] Seq=699 Ack=4403 Win=16425 Len=0

Frame 8: 54 bytes on wire (432 bits), 54 bytes captured (432 bits) on interface 0
    Interface id: 0
    Encapsulation type: Ethernet (1)
    Arrival Time: Apr  7, 2014 17:00:58.030285000 Eastern Daylight Time
    [Time shift for this packet: 0.000000000 seconds]
    Epoch Time: 1396904458.030285000 seconds
    [Time delta from previous captured frame: 0.000028000 seconds]
    [Time delta from previous displayed frame: 0.000028000 seconds]
    [Time since reference or first frame: 0.108594000 seconds]
    Frame Number: 8
    Frame Length: 54 bytes (432 bits)
    Capture Length: 54 bytes (432 bits)
    [Frame is marked: False]
    [Frame is ignored: False]
    [Protocols in frame: eth:ip:tcp]
    [Coloring Rule Name: TCP]
    [Coloring Rule String: tcp]
Ethernet II, Src: Hewlett-_97:fd:09 (1c:c1:de:97:fd:09), Dst: Vmware_7f:e3:53 (00:0c:29:7f:e3:53)
    Destination: Vmware_7f:e3:53 (00:0c:29:7f:e3:53)
        Address: Vmware_7f:e3:53 (00:0c:29:7f:e3:53)
        .... ..0. .... .... .... .... = LG bit: Globally unique address (factory default)
        .... ...0 .... .... .... .... = IG bit: Individual address (unicast)
    Source: Hewlett-_97:fd:09 (1c:c1:de:97:fd:09)
        Address: Hewlett-_97:fd:09 (1c:c1:de:97:fd:09)
        .... ..0. .... .... .... .... = LG bit: Globally unique address (factory default)
        .... ...0 .... .... .... .... = IG bit: Individual address (unicast)
    Type: IP (0x0800)
Internet Protocol Version 4, Src: 192.168.1.104 (192.168.1.104), Dst: 141.212.109.161 (141.212.109.161)
    Version: 4
    Header length: 20 bytes
    Differentiated Services Field: 0x00 (DSCP 0x00: Default; ECN: 0x00: Not-ECT (Not ECN-Capable Transport))
        0000 00.. = Differentiated Services Codepoint: Default (0x00)
        .... ..00 = Explicit Congestion Notification: Not-ECT (Not ECN-Capable Transport) (0x00)
    Total Length: 40
    Identification: 0x0268 (616)
    Flags: 0x02 (Don't Fragment)
        0... .... = Reserved bit: Not set
        .1.. .... = Don't fragment: Set
        ..0. .... = More fragments: Not set
    Fragment offset: 0
    Time to live: 128
    Protocol: TCP (6)
    Header checksum: 0x3ae2 [validation disabled]
        [Good: False]
        [Bad: False]
    Source: 192.168.1.104 (192.168.1.104)
    Destination: 141.212.109.161 (141.212.109.161)
    [Source GeoIP: Unknown]
    [Destination GeoIP: Unknown]
Transmission Control Protocol, Src Port: 49359 (49359), Dst Port: https (443), Seq: 699, Ack: 4403, Len: 0
    Source port: 49359 (49359)
    Destination port: https (443)
    [Stream index: 0]
    Sequence number: 699    (relative sequence number)
    Acknowledgment number: 4403    (relative ack number)
    Header length: 20 bytes
    Flags: 0x010 (ACK)
        000. .... .... = Reserved: Not set
        ...0 .... .... = Nonce: Not set
        .... 0... .... = Congestion Window Reduced (CWR): Not set
        .... .0.. .... = ECN-Echo: Not set
        .... ..0. .... = Urgent: Not set
        .... ...1 .... = Acknowledgment: Set
        .... .... 0... = Push: Not set
        .... .... .0.. = Reset: Not set
        .... .... ..0. = Syn: Not set
        .... .... ...0 = Fin: Not set
    Window size value: 16425
    [Calculated window size: 16425]
    [Window size scaling factor: -1 (unknown)]
    Checksum: 0x36ab [validation disabled]
        [Good Checksum: False]
        [Bad Checksum: False]
    [SEQ/ACK analysis]
        [This is an ACK to the segment in frame: 7]
        [The RTT to ACK the segment was: 0.000028000 seconds]

No.     Time           Source                Destination           Protocol Length Info
      9 0.108800000    141.212.109.161       192.168.1.104         TLSv1    1514   Application Data

Frame 9: 1514 bytes on wire (12112 bits), 1514 bytes captured (12112 bits) on interface 0
    Interface id: 0
    Encapsulation type: Ethernet (1)
    Arrival Time: Apr  7, 2014 17:00:58.030491000 Eastern Daylight Time
    [Time shift for this packet: 0.000000000 seconds]
    Epoch Time: 1396904458.030491000 seconds
    [Time delta from previous captured frame: 0.000206000 seconds]
    [Time delta from previous displayed frame: 0.000206000 seconds]
    [Time since reference or first frame: 0.108800000 seconds]
    Frame Number: 9
    Frame Length: 1514 bytes (12112 bits)
    Capture Length: 1514 bytes (12112 bits)
    [Frame is marked: False]
    [Frame is ignored: False]
    [Protocols in frame: eth:ip:tcp:ssl:ssl]
    [Coloring Rule Name: TCP]
    [Coloring Rule String: tcp]
Ethernet II, Src: Vmware_7f:e3:53 (00:0c:29:7f:e3:53), Dst: Hewlett-_97:fd:09 (1c:c1:de:97:fd:09)
    Destination: Hewlett-_97:fd:09 (1c:c1:de:97:fd:09)
        Address: Hewlett-_97:fd:09 (1c:c1:de:97:fd:09)
        .... ..0. .... .... .... .... = LG bit: Globally unique address (factory default)
        .... ...0 .... .... .... .... = IG bit: Individual address (unicast)
    Source: Vmware_7f:e3:53 (00:0c:29:7f:e3:53)
        Address: Vmware_7f:e3:53 (00:0c:29:7f:e3:53)
        .... ..0. .... .... .... .... = LG bit: Globally unique address (factory default)
        .... ...0 .... .... .... .... = IG bit: Individual address (unicast)
    Type: IP (0x0800)
Internet Protocol Version 4, Src: 141.212.109.161 (141.212.109.161), Dst: 192.168.1.104 (192.168.1.104)
    Version: 4
    Header length: 20 bytes
    Differentiated Services Field: 0x00 (DSCP 0x00: Default; ECN: 0x00: Not-ECT (Not ECN-Capable Transport))
        0000 00.. = Differentiated Services Codepoint: Default (0x00)
        .... ..00 = Explicit Congestion Notification: Not-ECT (Not ECN-Capable Transport) (0x00)
    Total Length: 1500
    Identification: 0x14d6 (5334)
    Flags: 0x02 (Don't Fragment)
        0... .... = Reserved bit: Not set
        .1.. .... = Don't fragment: Set
        ..0. .... = More fragments: Not set
    Fragment offset: 0
    Time to live: 54
    Protocol: TCP (6)
    Header checksum: 0x6cc0 [validation disabled]
        [Good: False]
        [Bad: False]
    Source: 141.212.109.161 (141.212.109.161)
    Destination: 192.168.1.104 (192.168.1.104)
    [Source GeoIP: Unknown]
    [Destination GeoIP: Unknown]
Transmission Control Protocol, Src Port: https (443), Dst Port: 49359 (49359), Seq: 4403, Ack: 699, Len: 1460
    Source port: https (443)
    Destination port: 49359 (49359)
    [Stream index: 0]
    Sequence number: 4403    (relative sequence number)
    [Next sequence number: 5863    (relative sequence number)]
    Acknowledgment number: 699    (relative ack number)
    Header length: 20 bytes
    Flags: 0x010 (ACK)
        000. .... .... = Reserved: Not set
        ...0 .... .... = Nonce: Not set
        .... 0... .... = Congestion Window Reduced (CWR): Not set
        .... .0.. .... = ECN-Echo: Not set
        .... ..0. .... = Urgent: Not set
        .... ...1 .... = Acknowledgment: Set
        .... .... 0... = Push: Not set
        .... .... .0.. = Reset: Not set
        .... .... ..0. = Syn: Not set
        .... .... ...0 = Fin: Not set
    Window size value: 16019
    [Calculated window size: 16019]
    [Window size scaling factor: -1 (unknown)]
    Checksum: 0x06af [validation disabled]
        [Good Checksum: False]
        [Bad Checksum: False]
    [SEQ/ACK analysis]
        [Bytes in flight: 1460]
    TCP segment data (1250 bytes)
    TCP segment data (173 bytes)
[3 Reassembled TCP Segments (4133 bytes): #6(1423), #7(1460), #9(1250)]
    [Frame: 6, payload: 0-1422 (1423 bytes)]
    [Frame: 7, payload: 1423-2882 (1460 bytes)]
    [Frame: 9, payload: 2883-4132 (1250 bytes)]
    [Segment count: 3]
    [Reassembled TCP length: 4133]
    [Reassembled TCP Data: 1703011020284d8c6c30a3eb7065db733a66e879d03d1f5f...]
Secure Sockets Layer
    TLSv1 Record Layer: Application Data Protocol: http
        Content Type: Application Data (23)
        Version: TLS 1.0 (0x0301)
        Length: 4128
        Encrypted Application Data: 284d8c6c30a3eb7065db733a66e879d03d1f5fd6e6e28de7...
Secure Sockets Layer
    TLSv1 Record Layer: Application Data Protocol: http
        Content Type: Application Data (23)
        Version: TLS 1.0 (0x0301)
        Length: 32
        Encrypted Application Data: 05c75f4dcdd9524ff6f0f951080dc8a846fc5458408f6d0b...

No.     Time           Source                Destination           Protocol Length Info
     10 0.121528000    141.212.109.161       192.168.1.104         TCP      1514   [TCP segment of a reassembled PDU]

Frame 10: 1514 bytes on wire (12112 bits), 1514 bytes captured (12112 bits) on interface 0
    Interface id: 0
    Encapsulation type: Ethernet (1)
    Arrival Time: Apr  7, 2014 17:00:58.043219000 Eastern Daylight Time
    [Time shift for this packet: 0.000000000 seconds]
    Epoch Time: 1396904458.043219000 seconds
    [Time delta from previous captured frame: 0.012728000 seconds]
    [Time delta from previous displayed frame: 0.012728000 seconds]
    [Time since reference or first frame: 0.121528000 seconds]
    Frame Number: 10
    Frame Length: 1514 bytes (12112 bits)
    Capture Length: 1514 bytes (12112 bits)
    [Frame is marked: False]
    [Frame is ignored: False]
    [Protocols in frame: eth:ip:tcp]
    [Coloring Rule Name: TCP]
    [Coloring Rule String: tcp]
Ethernet II, Src: Vmware_7f:e3:53 (00:0c:29:7f:e3:53), Dst: Hewlett-_97:fd:09 (1c:c1:de:97:fd:09)
    Destination: Hewlett-_97:fd:09 (1c:c1:de:97:fd:09)
        Address: Hewlett-_97:fd:09 (1c:c1:de:97:fd:09)
        .... ..0. .... .... .... .... = LG bit: Globally unique address (factory default)
        .... ...0 .... .... .... .... = IG bit: Individual address (unicast)
    Source: Vmware_7f:e3:53 (00:0c:29:7f:e3:53)
        Address: Vmware_7f:e3:53 (00:0c:29:7f:e3:53)
        .... ..0. .... .... .... .... = LG bit: Globally unique address (factory default)
        .... ...0 .... .... .... .... = IG bit: Individual address (unicast)
    Type: IP (0x0800)
Internet Protocol Version 4, Src: 141.212.109.161 (141.212.109.161), Dst: 192.168.1.104 (192.168.1.104)
    Version: 4
    Header length: 20 bytes
    Differentiated Services Field: 0x00 (DSCP 0x00: Default; ECN: 0x00: Not-ECT (Not ECN-Capable Transport))
        0000 00.. = Differentiated Services Codepoint: Default (0x00)
        .... ..00 = Explicit Congestion Notification: Not-ECT (Not ECN-Capable Transport) (0x00)
    Total Length: 1500
    Identification: 0x14d7 (5335)
    Flags: 0x02 (Don't Fragment)
        0... .... = Reserved bit: Not set
        .1.. .... = Don't fragment: Set
        ..0. .... = More fragments: Not set
    Fragment offset: 0
    Time to live: 54
    Protocol: TCP (6)
    Header checksum: 0x6cbf [validation disabled]
        [Good: False]
        [Bad: False]
    Source: 141.212.109.161 (141.212.109.161)
    Destination: 192.168.1.104 (192.168.1.104)
    [Source GeoIP: Unknown]
    [Destination GeoIP: Unknown]
Transmission Control Protocol, Src Port: https (443), Dst Port: 49359 (49359), Seq: 5863, Ack: 699, Len: 1460
    Source port: https (443)
    Destination port: 49359 (49359)
    [Stream index: 0]
    Sequence number: 5863    (relative sequence number)
