No.     Time           Source                Destination           Protocol Length Info
      1 0.000000000    192.168.1.104         74.125.225.112        TCP      66     49697 > https [SYN] Seq=0 Win=8192 Len=0 MSS=1460 WS=4 SACK_PERM=1

Frame 1: 66 bytes on wire (528 bits), 66 bytes captured (528 bits) on interface 0
    Interface id: 0
    Encapsulation type: Ethernet (1)
    Arrival Time: Apr  7, 2014 17:26:52.863690000 Eastern Daylight Time
    [Time shift for this packet: 0.000000000 seconds]
    Epoch Time: 1396906012.863690000 seconds
    [Time delta from previous captured frame: 0.000000000 seconds]
    [Time delta from previous displayed frame: 0.000000000 seconds]
    [Time since reference or first frame: 0.000000000 seconds]
    Frame Number: 1
    Frame Length: 66 bytes (528 bits)
    Capture Length: 66 bytes (528 bits)
    [Frame is marked: False]
    [Frame is ignored: False]
    [Protocols in frame: eth:ip:tcp]
    [Coloring Rule Name: TCP SYN/FIN]
    [Coloring Rule String: tcp.flags & 0x02 || tcp.flags.fin == 1]
Ethernet II, Src: Hewlett-_97:fd:09 (1c:c1:de:97:fd:09), Dst: Vmware_7f:e3:53 (00:0c:29:7f:e3:53)
    Destination: Vmware_7f:e3:53 (00:0c:29:7f:e3:53)
        Address: Vmware_7f:e3:53 (00:0c:29:7f:e3:53)
        .... ..0. .... .... .... .... = LG bit: Globally unique address (factory default)
        .... ...0 .... .... .... .... = IG bit: Individual address (unicast)
    Source: Hewlett-_97:fd:09 (1c:c1:de:97:fd:09)
        Address: Hewlett-_97:fd:09 (1c:c1:de:97:fd:09)
        .... ..0. .... .... .... .... = LG bit: Globally unique address (factory default)
        .... ...0 .... .... .... .... = IG bit: Individual address (unicast)
    Type: IP (0x0800)
Internet Protocol Version 4, Src: 192.168.1.104 (192.168.1.104), Dst: 74.125.225.112 (74.125.225.112)
    Version: 4
    Header length: 20 bytes
    Differentiated Services Field: 0x00 (DSCP 0x00: Default; ECN: 0x00: Not-ECT (Not ECN-Capable Transport))
        0000 00.. = Differentiated Services Codepoint: Default (0x00)
        .... ..00 = Explicit Congestion Notification: Not-ECT (Not ECN-Capable Transport) (0x00)
    Total Length: 52
    Identification: 0x4646 (17990)
    Flags: 0x02 (Don't Fragment)
        0... .... = Reserved bit: Not set
        .1.. .... = Don't fragment: Set
        ..0. .... = More fragments: Not set
    Fragment offset: 0
    Time to live: 128
    Protocol: TCP (6)
    Header checksum: 0xc67f [validation disabled]
        [Good: False]
        [Bad: False]
    Source: 192.168.1.104 (192.168.1.104)
    Destination: 74.125.225.112 (74.125.225.112)
    [Source GeoIP: Unknown]
    [Destination GeoIP: Unknown]
Transmission Control Protocol, Src Port: 49697 (49697), Dst Port: https (443), Seq: 0, Len: 0
    Source port: 49697 (49697)
    Destination port: https (443)
    [Stream index: 0]
    Sequence number: 0    (relative sequence number)
    Header length: 32 bytes
    Flags: 0x002 (SYN)
        000. .... .... = Reserved: Not set
        ...0 .... .... = Nonce: Not set
        .... 0... .... = Congestion Window Reduced (CWR): Not set
        .... .0.. .... = ECN-Echo: Not set
        .... ..0. .... = Urgent: Not set
        .... ...0 .... = Acknowledgment: Not set
        .... .... 0... = Push: Not set
        .... .... .0.. = Reset: Not set
        .... .... ..1. = Syn: Set
            [Expert Info (Chat/Sequence): Connection establish request (SYN): server port https]
                [Message: Connection establish request (SYN): server port https]
                [Severity level: Chat]
                [Group: Sequence]
        .... .... ...0 = Fin: Not set
    Window size value: 8192
    [Calculated window size: 8192]
    Checksum: 0x9198 [validation disabled]
        [Good Checksum: False]
        [Bad Checksum: False]
    Options: (12 bytes), Maximum segment size, No-Operation (NOP), Window scale, No-Operation (NOP), No-Operation (NOP), SACK permitted
        Maximum segment size: 1460 bytes
            Kind: MSS size (2)
            Length: 4
            MSS Value: 1460
        No-Operation (NOP)
            Type: 1
                0... .... = Copy on fragmentation: No
                .00. .... = Class: Control (0)
                ...0 0001 = Number: No-Operation (NOP) (1)
        Window scale: 2 (multiply by 4)
            Kind: Window Scale (3)
            Length: 3
            Shift count: 2
            [Multiplier: 4]
        No-Operation (NOP)
            Type: 1
                0... .... = Copy on fragmentation: No
                .00. .... = Class: Control (0)
                ...0 0001 = Number: No-Operation (NOP) (1)
        No-Operation (NOP)
            Type: 1
                0... .... = Copy on fragmentation: No
                .00. .... = Class: Control (0)
                ...0 0001 = Number: No-Operation (NOP) (1)
        TCP SACK Permitted Option: True
            Kind: SACK Permission (4)
            Length: 2

No.     Time           Source                Destination           Protocol Length Info
      2 0.006740000    74.125.225.112        192.168.1.104         TCP      66     https > 49697 [SYN, ACK] Seq=0 Ack=1 Win=42900 Len=0 MSS=1430 SACK_PERM=1 WS=64

Frame 2: 66 bytes on wire (528 bits), 66 bytes captured (528 bits) on interface 0
    Interface id: 0
    Encapsulation type: Ethernet (1)
    Arrival Time: Apr  7, 2014 17:26:52.870430000 Eastern Daylight Time
    [Time shift for this packet: 0.000000000 seconds]
    Epoch Time: 1396906012.870430000 seconds
    [Time delta from previous captured frame: 0.006740000 seconds]
    [Time delta from previous displayed frame: 0.006740000 seconds]
    [Time since reference or first frame: 0.006740000 seconds]
    Frame Number: 2
    Frame Length: 66 bytes (528 bits)
    Capture Length: 66 bytes (528 bits)
    [Frame is marked: False]
    [Frame is ignored: False]
    [Protocols in frame: eth:ip:tcp]
    [Coloring Rule Name: TCP SYN/FIN]
    [Coloring Rule String: tcp.flags & 0x02 || tcp.flags.fin == 1]
Ethernet II, Src: Vmware_7f:e3:53 (00:0c:29:7f:e3:53), Dst: Hewlett-_97:fd:09 (1c:c1:de:97:fd:09)
    Destination: Hewlett-_97:fd:09 (1c:c1:de:97:fd:09)
        Address: Hewlett-_97:fd:09 (1c:c1:de:97:fd:09)
        .... ..0. .... .... .... .... = LG bit: Globally unique address (factory default)
        .... ...0 .... .... .... .... = IG bit: Individual address (unicast)
    Source: Vmware_7f:e3:53 (00:0c:29:7f:e3:53)
        Address: Vmware_7f:e3:53 (00:0c:29:7f:e3:53)
        .... ..0. .... .... .... .... = LG bit: Globally unique address (factory default)
        .... ...0 .... .... .... .... = IG bit: Individual address (unicast)
    Type: IP (0x0800)
Internet Protocol Version 4, Src: 74.125.225.112 (74.125.225.112), Dst: 192.168.1.104 (192.168.1.104)
    Version: 4
    Header length: 20 bytes
    Differentiated Services Field: 0x00 (DSCP 0x00: Default; ECN: 0x00: Not-ECT (Not ECN-Capable Transport))
        0000 00.. = Differentiated Services Codepoint: Default (0x00)
        .... ..00 = Explicit Congestion Notification: Not-ECT (Not ECN-Capable Transport) (0x00)
    Total Length: 52
    Identification: 0xdde7 (56807)
    Flags: 0x00
        0... .... = Reserved bit: Not set
        .0.. .... = Don't fragment: Not set
        ..0. .... = More fragments: Not set
    Fragment offset: 0
    Time to live: 57
    Protocol: TCP (6)
    Header checksum: 0xb5de [validation disabled]
        [Good: False]
        [Bad: False]
    Source: 74.125.225.112 (74.125.225.112)
    Destination: 192.168.1.104 (192.168.1.104)
    [Source GeoIP: Unknown]
    [Destination GeoIP: Unknown]
Transmission Control Protocol, Src Port: https (443), Dst Port: 49697 (49697), Seq: 0, Ack: 1, Len: 0
    Source port: https (443)
    Destination port: 49697 (49697)
    [Stream index: 0]
    Sequence number: 0    (relative sequence number)
    Acknowledgment number: 1    (relative ack number)
    Header length: 32 bytes
    Flags: 0x012 (SYN, ACK)
        000. .... .... = Reserved: Not set
        ...0 .... .... = Nonce: Not set
        .... 0... .... = Congestion Window Reduced (CWR): Not set
        .... .0.. .... = ECN-Echo: Not set
        .... ..0. .... = Urgent: Not set
        .... ...1 .... = Acknowledgment: Set
        .... .... 0... = Push: Not set
        .... .... .0.. = Reset: Not set
        .... .... ..1. = Syn: Set
            [Expert Info (Chat/Sequence): Connection establish acknowledge (SYN+ACK): server port https]
                [Message: Connection establish acknowledge (SYN+ACK): server port https]
                [Severity level: Chat]
                [Group: Sequence]
        .... .... ...0 = Fin: Not set
    Window size value: 42900
    [Calculated window size: 42900]
    Checksum: 0x0a18 [validation disabled]
        [Good Checksum: False]
        [Bad Checksum: False]
    Options: (12 bytes), Maximum segment size, No-Operation (NOP), No-Operation (NOP), SACK permitted, No-Operation (NOP), Window scale
        Maximum segment size: 1430 bytes
            Kind: MSS size (2)
            Length: 4
            MSS Value: 1430
        No-Operation (NOP)
            Type: 1
                0... .... = Copy on fragmentation: No
                .00. .... = Class: Control (0)
                ...0 0001 = Number: No-Operation (NOP) (1)
        No-Operation (NOP)
            Type: 1
                0... .... = Copy on fragmentation: No
                .00. .... = Class: Control (0)
                ...0 0001 = Number: No-Operation (NOP) (1)
        TCP SACK Permitted Option: True
            Kind: SACK Permission (4)
            Length: 2
        No-Operation (NOP)
            Type: 1
                0... .... = Copy on fragmentation: No
                .00. .... = Class: Control (0)
                ...0 0001 = Number: No-Operation (NOP) (1)
        Window scale: 6 (multiply by 64)
            Kind: Window Scale (3)
            Length: 3
            Shift count: 6
            [Multiplier: 64]
    [SEQ/ACK analysis]
        [This is an ACK to the segment in frame: 1]
        [The RTT to ACK the segment was: 0.006740000 seconds]

No.     Time           Source                Destination           Protocol Length Info
      3 0.006839000    192.168.1.104         74.125.225.112        TCP      54     49697 > https [ACK] Seq=1 Ack=1 Win=65780 Len=0

Frame 3: 54 bytes on wire (432 bits), 54 bytes captured (432 bits) on interface 0
    Interface id: 0
    Encapsulation type: Ethernet (1)
    Arrival Time: Apr  7, 2014 17:26:52.870529000 Eastern Daylight Time
    [Time shift for this packet: 0.000000000 seconds]
    Epoch Time: 1396906012.870529000 seconds
    [Time delta from previous captured frame: 0.000099000 seconds]
    [Time delta from previous displayed frame: 0.000099000 seconds]
    [Time since reference or first frame: 0.006839000 seconds]
    Frame Number: 3
    Frame Length: 54 bytes (432 bits)
    Capture Length: 54 bytes (432 bits)
    [Frame is marked: False]
    [Frame is ignored: False]
    [Protocols in frame: eth:ip:tcp]
    [Coloring Rule Name: TCP]
    [Coloring Rule String: tcp]
Ethernet II, Src: Hewlett-_97:fd:09 (1c:c1:de:97:fd:09), Dst: Vmware_7f:e3:53 (00:0c:29:7f:e3:53)
    Destination: Vmware_7f:e3:53 (00:0c:29:7f:e3:53)
        Address: Vmware_7f:e3:53 (00:0c:29:7f:e3:53)
        .... ..0. .... .... .... .... = LG bit: Globally unique address (factory default)
        .... ...0 .... .... .... .... = IG bit: Individual address (unicast)
    Source: Hewlett-_97:fd:09 (1c:c1:de:97:fd:09)
        Address: Hewlett-_97:fd:09 (1c:c1:de:97:fd:09)
        .... ..0. .... .... .... .... = LG bit: Globally unique address (factory default)
        .... ...0 .... .... .... .... = IG bit: Individual address (unicast)
    Type: IP (0x0800)
Internet Protocol Version 4, Src: 192.168.1.104 (192.168.1.104), Dst: 74.125.225.112 (74.125.225.112)
    Version: 4
    Header length: 20 bytes
    Differentiated Services Field: 0x00 (DSCP 0x00: Default; ECN: 0x00: Not-ECT (Not ECN-Capable Transport))
        0000 00.. = Differentiated Services Codepoint: Default (0x00)
        .... ..00 = Explicit Congestion Notification: Not-ECT (Not ECN-Capable Transport) (0x00)
    Total Length: 40
    Identification: 0x4647 (17991)
    Flags: 0x02 (Don't Fragment)
        0... .... = Reserved bit: Not set
        .1.. .... = Don't fragment: Set
        ..0. .... = More fragments: Not set
    Fragment offset: 0
    Time to live: 128
    Protocol: TCP (6)
    Header checksum: 0xc68a [validation disabled]
        [Good: False]
        [Bad: False]
    Source: 192.168.1.104 (192.168.1.104)
    Destination: 74.125.225.112 (74.125.225.112)
    [Source GeoIP: Unknown]
    [Destination GeoIP: Unknown]
Transmission Control Protocol, Src Port: 49697 (49697), Dst Port: https (443), Seq: 1, Ack: 1, Len: 0
    Source port: 49697 (49697)
    Destination port: https (443)
    [Stream index: 0]
    Sequence number: 1    (relative sequence number)
    Acknowledgment number: 1    (relative ack number)
    Header length: 20 bytes
    Flags: 0x010 (ACK)
        000. .... .... = Reserved: Not set
        ...0 .... .... = Nonce: Not set
        .... 0... .... = Congestion Window Reduced (CWR): Not set
        .... .0.. .... = ECN-Echo: Not set
        .... ..0. .... = Urgent: Not set
        .... ...1 .... = Acknowledgment: Set
        .... .... 0... = Push: Not set
        .... .... .0.. = Reset: Not set
        .... .... ..0. = Syn: Not set
        .... .... ...0 = Fin: Not set
    Window size value: 16445
    [Calculated window size: 65780]
    [Window size scaling factor: 4]
    Checksum: 0xb222 [validation disabled]
        [Good Checksum: False]
        [Bad Checksum: False]
    [SEQ/ACK analysis]
        [This is an ACK to the segment in frame: 2]
        [The RTT to ACK the segment was: 0.000099000 seconds]

No.     Time           Source                Destination           Protocol Length Info
      4 0.007174000    192.168.1.104         74.125.225.112        TLSv1    221    Client Hello

Frame 4: 221 bytes on wire (1768 bits), 221 bytes captured (1768 bits) on interface 0
    Interface id: 0
    Encapsulation type: Ethernet (1)
    Arrival Time: Apr  7, 2014 17:26:52.870864000 Eastern Daylight Time
    [Time shift for this packet: 0.000000000 seconds]
    Epoch Time: 1396906012.870864000 seconds
    [Time delta from previous captured frame: 0.000335000 seconds]
    [Time delta from previous displayed frame: 0.000335000 seconds]
    [Time since reference or first frame: 0.007174000 seconds]
    Frame Number: 4
    Frame Length: 221 bytes (1768 bits)
    Capture Length: 221 bytes (1768 bits)
    [Frame is marked: False]
    [Frame is ignored: False]
    [Protocols in frame: eth:ip:tcp:ssl]
    [Coloring Rule Name: TCP]
    [Coloring Rule String: tcp]
Ethernet II, Src: Hewlett-_97:fd:09 (1c:c1:de:97:fd:09), Dst: Vmware_7f:e3:53 (00:0c:29:7f:e3:53)
    Destination: Vmware_7f:e3:53 (00:0c:29:7f:e3:53)
        Address: Vmware_7f:e3:53 (00:0c:29:7f:e3:53)
        .... ..0. .... .... .... .... = LG bit: Globally unique address (factory default)
        .... ...0 .... .... .... .... = IG bit: Individual address (unicast)
    Source: Hewlett-_97:fd:09 (1c:c1:de:97:fd:09)
        Address: Hewlett-_97:fd:09 (1c:c1:de:97:fd:09)
        .... ..0. .... .... .... .... = LG bit: Globally unique address (factory default)
        .... ...0 .... .... .... .... = IG bit: Individual address (unicast)
    Type: IP (0x0800)
Internet Protocol Version 4, Src: 192.168.1.104 (192.168.1.104), Dst: 74.125.225.112 (74.125.225.112)
    Version: 4
    Header length: 20 bytes
    Differentiated Services Field: 0x00 (DSCP 0x00: Default; ECN: 0x00: Not-ECT (Not ECN-Capable Transport))
        0000 00.. = Differentiated Services Codepoint: Default (0x00)
        .... ..00 = Explicit Congestion Notification: Not-ECT (Not ECN-Capable Transport) (0x00)
    Total Length: 207
    Identification: 0x4648 (17992)
    Flags: 0x02 (Don't Fragment)
        0... .... = Reserved bit: Not set
        .1.. .... = Don't fragment: Set
        ..0. .... = More fragments: Not set
    Fragment offset: 0
    Time to live: 128
    Protocol: TCP (6)
    Header checksum: 0xc5e2 [validation disabled]
        [Good: False]
        [Bad: False]
    Source: 192.168.1.104 (192.168.1.104)
    Destination: 74.125.225.112 (74.125.225.112)
    [Source GeoIP: Unknown]
    [Destination GeoIP: Unknown]
Transmission Control Protocol, Src Port: 49697 (49697), Dst Port: https (443), Seq: 1, Ack: 1, Len: 167
    Source port: 49697 (49697)
    Destination port: https (443)
    [Stream index: 0]
    Sequence number: 1    (relative sequence number)
    [Next sequence number: 168    (relative sequence number)]
    Acknowledgment number: 1    (relative ack number)
    Header length: 20 bytes
    Flags: 0x018 (PSH, ACK)
        000. .... .... = Reserved: Not set
        ...0 .... .... = Nonce: Not set
        .... 0... .... = Congestion Window Reduced (CWR): Not set
        .... .0.. .... = ECN-Echo: Not set
        .... ..0. .... = Urgent: Not set
        .... ...1 .... = Acknowledgment: Set
        .... .... 1... = Push: Set
        .... .... .0.. = Reset: Not set
        .... .... ..0. = Syn: Not set
        .... .... ...0 = Fin: Not set
    Window size value: 16445
    [Calculated window size: 65780]
    [Window size scaling factor: 4]
    Checksum: 0xcee9 [validation disabled]
        [Good Checksum: False]
        [Bad Checksum: False]
    [SEQ/ACK analysis]
        [Bytes in flight: 167]
Secure Sockets Layer
    TLSv1 Record Layer: Handshake Protocol: Client Hello
        Content Type: Handshake (22)
        Version: TLS 1.0 (0x0301)
        Length: 162
        Handshake Protocol: Client Hello
            Handshake Type: Client Hello (1)
            Length: 158
            Version: TLS 1.0 (0x0301)
            Random
                gmt_unix_time: Apr  7, 2014 17:26:52.000000000 Eastern Daylight Time
                random_bytes: 1076d9f84e0b292ca898b6c90f71c4e0fb20b78965a94e9b...
            Session ID Length: 0
            Cipher Suites Length: 72
            Cipher Suites (36 suites)
                Cipher Suite: TLS_EMPTY_RENEGOTIATION_INFO_SCSV (0x00ff)
                Cipher Suite: TLS_ECDHE_ECDSA_WITH_AES_256_CBC_SHA (0xc00a)
                Cipher Suite: TLS_ECDHE_RSA_WITH_AES_256_CBC_SHA (0xc014)
                Cipher Suite: TLS_DHE_RSA_WITH_CAMELLIA_256_CBC_SHA (0x0088)
                Cipher Suite: TLS_DHE_DSS_WITH_CAMELLIA_256_CBC_SHA (0x0087)
                Cipher Suite: TLS_DHE_RSA_WITH_AES_256_CBC_SHA (0x0039)
                Cipher Suite: TLS_DHE_DSS_WITH_AES_256_CBC_SHA (0x0038)
                Cipher Suite: TLS_ECDH_RSA_WITH_AES_256_CBC_SHA (0xc00f)
                Cipher Suite: TLS_ECDH_ECDSA_WITH_AES_256_CBC_SHA (0xc005)
                Cipher Suite: TLS_RSA_WITH_CAMELLIA_256_CBC_SHA (0x0084)
                Cipher Suite: TLS_RSA_WITH_AES_256_CBC_SHA (0x0035)
                Cipher Suite: TLS_ECDHE_ECDSA_WITH_RC4_128_SHA (0xc007)
                Cipher Suite: TLS_ECDHE_ECDSA_WITH_AES_128_CBC_SHA (0xc009)
                Cipher Suite: TLS_ECDHE_RSA_WITH_RC4_128_SHA (0xc011)
                Cipher Suite: TLS_ECDHE_RSA_WITH_AES_128_CBC_SHA (0xc013)
                Cipher Suite: TLS_DHE_RSA_WITH_CAMELLIA_128_CBC_SHA (0x0045)
                Cipher Suite: TLS_DHE_DSS_WITH_CAMELLIA_128_CBC_SHA (0x0044)
                Cipher Suite: TLS_DHE_RSA_WITH_AES_128_CBC_SHA (0x0033)
                Cipher Suite: TLS_DHE_DSS_WITH_AES_128_CBC_SHA (0x0032)
                Cipher Suite: TLS_ECDH_RSA_WITH_RC4_128_SHA (0xc00c)
                Cipher Suite: TLS_ECDH_RSA_WITH_AES_128_CBC_SHA (0xc00e)
                Cipher Suite: TLS_ECDH_ECDSA_WITH_RC4_128_SHA (0xc002)
                Cipher Suite: TLS_ECDH_ECDSA_WITH_AES_128_CBC_SHA (0xc004)
                Cipher Suite: TLS_RSA_WITH_SEED_CBC_SHA (0x0096)
                Cipher Suite: TLS_RSA_WITH_CAMELLIA_128_CBC_SHA (0x0041)
                Cipher Suite: TLS_RSA_WITH_RC4_128_MD5 (0x0004)
                Cipher Suite: TLS_RSA_WITH_RC4_128_SHA (0x0005)
                Cipher Suite: TLS_RSA_WITH_AES_128_CBC_SHA (0x002f)
                Cipher Suite: TLS_ECDHE_ECDSA_WITH_3DES_EDE_CBC_SHA (0xc008)
                Cipher Suite: TLS_ECDHE_RSA_WITH_3DES_EDE_CBC_SHA (0xc012)
                Cipher Suite: TLS_DHE_RSA_WITH_3DES_EDE_CBC_SHA (0x0016)
                Cipher Suite: TLS_DHE_DSS_WITH_3DES_EDE_CBC_SHA (0x0013)
                Cipher Suite: TLS_ECDH_RSA_WITH_3DES_EDE_CBC_SHA (0xc00d)
                Cipher Suite: TLS_ECDH_ECDSA_WITH_3DES_EDE_CBC_SHA (0xc003)
                Cipher Suite: SSL_RSA_FIPS_WITH_3DES_EDE_CBC_SHA (0xfeff)
                Cipher Suite: TLS_RSA_WITH_3DES_EDE_CBC_SHA (0x000a)
            Compression Methods Length: 1
            Compression Methods (1 method)
                Compression Method: null (0)
            Extensions Length: 45
            Extension: server_name
                Type: server_name (0x0000)
                Length: 19
                Server Name Indication extension
                    Server Name list length: 17
                    Server Name Type: host_name (0)
                    Server Name length: 14
                    Server Name: www.google.com
            Extension: elliptic_curves
                Type: elliptic_curves (0x000a)
                Length: 8
                Elliptic Curves Length: 6
                Elliptic curves (3 curves)
                    Elliptic curve: secp256r1 (0x0017)
                    Elliptic curve: secp384r1 (0x0018)
                    Elliptic curve: secp521r1 (0x0019)
            Extension: ec_point_formats
                Type: ec_point_formats (0x000b)
                Length: 2
                EC point formats Length: 1
                Elliptic curves point formats (1)
                    EC point format: uncompressed (0)
            Extension: SessionTicket TLS
                Type: SessionTicket TLS (0x0023)
                Length: 0
                Data (0 bytes)

No.     Time           Source                Destination           Protocol Length Info
      5 0.013675000    74.125.225.112        192.168.1.104         TCP      60     https > 49697 [ACK] Seq=1 Ack=168 Win=42752 Len=0

Frame 5: 60 bytes on wire (480 bits), 60 bytes captured (480 bits) on interface 0
    Interface id: 0
    Encapsulation type: Ethernet (1)
    Arrival Time: Apr  7, 2014 17:26:52.877365000 Eastern Daylight Time
    [Time shift for this packet: 0.000000000 seconds]
    Epoch Time: 1396906012.877365000 seconds
    [Time delta from previous captured frame: 0.006501000 seconds]
    [Time delta from previous displayed frame: 0.006501000 seconds]
    [Time since reference or first frame: 0.013675000 seconds]
    Frame Number: 5
    Frame Length: 60 bytes (480 bits)
    Capture Length: 60 bytes (480 bits)
    [Frame is marked: False]
    [Frame is ignored: False]
    [Protocols in frame: eth:ip:tcp]
    [Coloring Rule Name: TCP]
    [Coloring Rule String: tcp]
Ethernet II, Src: Vmware_7f:e3:53 (00:0c:29:7f:e3:53), Dst: Hewlett-_97:fd:09 (1c:c1:de:97:fd:09)
    Destination: Hewlett-_97:fd:09 (1c:c1:de:97:fd:09)
        Address: Hewlett-_97:fd:09 (1c:c1:de:97:fd:09)
        .... ..0. .... .... .... .... = LG bit: Globally unique address (factory default)
        .... ...0 .... .... .... .... = IG bit: Individual address (unicast)
    Source: Vmware_7f:e3:53 (00:0c:29:7f:e3:53)
        Address: Vmware_7f:e3:53 (00:0c:29:7f:e3:53)
        .... ..0. .... .... .... .... = LG bit: Globally unique address (factory default)
        .... ...0 .... .... .... .... = IG bit: Individual address (unicast)
    Type: IP (0x0800)
    Padding: 000000000000
Internet Protocol Version 4, Src: 74.125.225.112 (74.125.225.112), Dst: 192.168.1.104 (192.168.1.104)
    Version: 4
    Header length: 20 bytes
    Differentiated Services Field: 0x00 (DSCP 0x00: Default; ECN: 0x00: Not-ECT (Not ECN-Capable Transport))
        0000 00.. = Differentiated Services Codepoint: Default (0x00)
        .... ..00 = Explicit Congestion Notification: Not-ECT (Not ECN-Capable Transport) (0x00)
    Total Length: 40
    Identification: 0xdde8 (56808)
    Flags: 0x00
        0... .... = Reserved bit: Not set
        .0.. .... = Don't fragment: Not set
        ..0. .... = More fragments: Not set
    Fragment offset: 0
    Time to live: 57
    Protocol: TCP (6)
    Header checksum: 0xb5e9 [validation disabled]
        [Good: False]
        [Bad: False]
    Source: 74.125.225.112 (74.125.225.112)
    Destination: 192.168.1.104 (192.168.1.104)
    [Source GeoIP: Unknown]
    [Destination GeoIP: Unknown]
Transmission Control Protocol, Src Port: https (443), Dst Port: 49697 (49697), Seq: 1, Ack: 168, Len: 0
    Source port: https (443)
    Destination port: 49697 (49697)
    [Stream index: 0]
    Sequence number: 1    (relative sequence number)
    Acknowledgment number: 168    (relative ack number)
    Header length: 20 bytes
    Flags: 0x010 (ACK)
        000. .... .... = Reserved: Not set
        ...0 .... .... = Nonce: Not set
        .... 0... .... = Congestion Window Reduced (CWR): Not set
        .... .0.. .... = ECN-Echo: Not set
        .... ..0. .... = Urgent: Not set
        .... ...1 .... = Acknowledgment: Set
        .... .... 0... = Push: Not set
        .... .... .0.. = Reset: Not set
        .... .... ..0. = Syn: Not set
        .... .... ...0 = Fin: Not set
    Window size value: 668
    [Calculated window size: 42752]
    [Window size scaling factor: 64]
    Checksum: 0xef1c [validation disabled]
        [Good Checksum: False]
        [Bad Checksum: False]
    [SEQ/ACK analysis]
        [This is an ACK to the segment in frame: 4]
        [The RTT to ACK the segment was: 0.006501000 seconds]

No.     Time           Source                Destination           Protocol Length Info
      6 0.016081000    74.125.225.112        192.168.1.104         TLSv1    1484   Server Hello

Frame 6: 1484 bytes on wire (11872 bits), 1484 bytes captured (11872 bits) on interface 0
    Interface id: 0
    Encapsulation type: Ethernet (1)
    Arrival Time: Apr  7, 2014 17:26:52.879771000 Eastern Daylight Time
    [Time shift for this packet: 0.000000000 seconds]
    Epoch Time: 1396906012.879771000 seconds
    [Time delta from previous captured frame: 0.002406000 seconds]
    [Time delta from previous displayed frame: 0.002406000 seconds]
    [Time since reference or first frame: 0.016081000 seconds]
    Frame Number: 6
    Frame Length: 1484 bytes (11872 bits)
    Capture Length: 1484 bytes (11872 bits)
    [Frame is marked: False]
    [Frame is ignored: False]
    [Protocols in frame: eth:ip:tcp:ssl]
    [Coloring Rule Name: TCP]
    [Coloring Rule String: tcp]
Ethernet II, Src: Vmware_7f:e3:53 (00:0c:29:7f:e3:53), Dst: Hewlett-_97:fd:09 (1c:c1:de:97:fd:09)
    Destination: Hewlett-_97:fd:09 (1c:c1:de:97:fd:09)
        Address: Hewlett-_97:fd:09 (1c:c1:de:97:fd:09)
        .... ..0. .... .... .... .... = LG bit: Globally unique address (factory default)
        .... ...0 .... .... .... .... = IG bit: Individual address (unicast)
    Source: Vmware_7f:e3:53 (00:0c:29:7f:e3:53)
        Address: Vmware_7f:e3:53 (00:0c:29:7f:e3:53)
        .... ..0. .... .... .... .... = LG bit: Globally unique address (factory default)
        .... ...0 .... .... .... .... = IG bit: Individual address (unicast)
    Type: IP (0x0800)
Internet Protocol Version 4, Src: 74.125.225.112 (74.125.225.112), Dst: 192.168.1.104 (192.168.1.104)
    Version: 4
    Header length: 20 bytes
    Differentiated Services Field: 0x00 (DSCP 0x00: Default; ECN: 0x00: Not-ECT (Not ECN-Capable Transport))
        0000 00.. = Differentiated Services Codepoint: Default (0x00)
        .... ..00 = Explicit Congestion Notification: Not-ECT (Not ECN-Capable Transport) (0x00)
    Total Length: 1470
    Identification: 0xddea (56810)
    Flags: 0x00
        0... .... = Reserved bit: Not set
        .0.. .... = Don't fragment: Not set
        ..0. .... = More fragments: Not set
    Fragment offset: 0
    Time to live: 57
    Protocol: TCP (6)
    Header checksum: 0xb051 [validation disabled]
        [Good: False]
        [Bad: False]
    Source: 74.125.225.112 (74.125.225.112)
    Destination: 192.168.1.104 (192.168.1.104)
    [Source GeoIP: Unknown]
    [Destination GeoIP: Unknown]
Transmission Control Protocol, Src Port: https (443), Dst Port: 49697 (49697), Seq: 1, Ack: 168, Len: 1430
    Source port: https (443)
    Destination port: 49697 (49697)
    [Stream index: 0]
    Sequence number: 1    (relative sequence number)
    [Next sequence number: 1431    (relative sequence number)]
    Acknowledgment number: 168    (relative ack number)
    Header length: 20 bytes
    Flags: 0x010 (ACK)
        000. .... .... = Reserved: Not set
        ...0 .... .... = Nonce: Not set
        .... 0... .... = Congestion Window Reduced (CWR): Not set
        .... .0.. .... = ECN-Echo: Not set
        .... ..0. .... = Urgent: Not set
        .... ...1 .... = Acknowledgment: Set
        .... .... 0... = Push: Not set
        .... .... .0.. = Reset: Not set
        .... .... ..0. = Syn: Not set
        .... .... ...0 = Fin: Not set
    Window size value: 668
    [Calculated window size: 42752]
    [Window size scaling factor: 64]
    Checksum: 0x92c2 [validation disabled]
        [Good Checksum: False]
        [Bad Checksum: False]
    [SEQ/ACK analysis]
        [Bytes in flight: 1430]
    TCP segment data (1360 bytes)
Secure Sockets Layer
    TLSv1 Record Layer: Handshake Protocol: Server Hello
        Content Type: Handshake (22)
        Version: TLS 1.0 (0x0301)
        Length: 65
        Handshake Protocol: Server Hello
            Handshake Type: Server Hello (2)
            Length: 61
            Version: TLS 1.0 (0x0301)
            Random
                gmt_unix_time: Apr  7, 2014 17:26:52.000000000 Eastern Daylight Time
                random_bytes: 91c6099db69900938a5f6e54df3fae216d97e1f286367b07...
            Session ID Length: 0
            Cipher Suite: TLS_ECDHE_RSA_WITH_RC4_128_SHA (0xc011)
            Compression Method: null (0)
            Extensions Length: 21
            Extension: server_name
                Type: server_name (0x0000)
                Length: 0
            Extension: renegotiation_info
                Type: renegotiation_info (0xff01)
                Length: 1
                Renegotiation Info extension
                    Renegotiation info extension length: 0
            Extension: ec_point_formats
                Type: ec_point_formats (0x000b)
                Length: 4
                EC point formats Length: 3
                Elliptic curves point formats (3)
                    EC point format: uncompressed (0)
                    EC point format: ansiX962_compressed_prime (1)
                    EC point format: ansiX962_compressed_char2 (2)
            Extension: SessionTicket TLS
                Type: SessionTicket TLS (0x0023)
                Length: 0
                Data (0 bytes)

No.     Time           Source                Destination           Protocol Length Info
      7 0.016103000    74.125.225.112        192.168.1.104         TCP      1484   [TCP segment of a reassembled PDU]

Frame 7: 1484 bytes on wire (11872 bits), 1484 bytes captured (11872 bits) on interface 0
    Interface id: 0
    Encapsulation type: Ethernet (1)
    Arrival Time: Apr  7, 2014 17:26:52.879793000 Eastern Daylight Time
    [Time shift for this packet: 0.000000000 seconds]
    Epoch Time: 1396906012.879793000 seconds
    [Time delta from previous captured frame: 0.000022000 seconds]
    [Time delta from previous displayed frame: 0.000022000 seconds]
    [Time since reference or first frame: 0.016103000 seconds]
    Frame Number: 7
    Frame Length: 1484 bytes (11872 bits)
    Capture Length: 1484 bytes (11872 bits)
    [Frame is marked: False]
    [Frame is ignored: False]
    [Protocols in frame: eth:ip:tcp]
    [Coloring Rule Name: TCP]
    [Coloring Rule String: tcp]
Ethernet II, Src: Vmware_7f:e3:53 (00:0c:29:7f:e3:53), Dst: Hewlett-_97:fd:09 (1c:c1:de:97:fd:09)
    Destination: Hewlett-_97:fd:09 (1c:c1:de:97:fd:09)
        Address: Hewlett-_97:fd:09 (1c:c1:de:97:fd:09)
        .... ..0. .... .... .... .... = LG bit: Globally unique address (factory default)
        .... ...0 .... .... .... .... = IG bit: Individual address (unicast)
    Source: Vmware_7f:e3:53 (00:0c:29:7f:e3:53)
        Address: Vmware_7f:e3:53 (00:0c:29:7f:e3:53)
        .... ..0. .... .... .... .... = LG bit: Globally unique address (factory default)
        .... ...0 .... .... .... .... = IG bit: Individual address (unicast)
    Type: IP (0x0800)
Internet Protocol Version 4, Src: 74.125.225.112 (74.125.225.112), Dst: 192.168.1.104 (192.168.1.104)
    Version: 4
    Header length: 20 bytes
    Differentiated Services Field: 0x00 (DSCP 0x00: Default; ECN: 0x00: Not-ECT (Not ECN-Capable Transport))
        0000 00.. = Differentiated Services Codepoint: Default (0x00)
        .... ..00 = Explicit Congestion Notification: Not-ECT (Not ECN-Capable Transport) (0x00)
    Total Length: 1470
    Identification: 0xddeb (56811)
    Flags: 0x00
        0... .... = Reserved bit: Not set
        .0.. .... = Don't fragment: Not set
        ..0. .... = More fragments: Not set
    Fragment offset: 0
    Time to live: 57
    Protocol: TCP (6)
    Header checksum: 0xb050 [validation disabled]
        [Good: False]
        [Bad: False]
    Source: 74.125.225.112 (74.125.225.112)
    Destination: 192.168.1.104 (192.168.1.104)
    [Source GeoIP: Unknown]
    [Destination GeoIP: Unknown]
Transmission Control Protocol, Src Port: https (443), Dst Port: 49697 (49697), Seq: 1431, Ack: 168, Len: 1430
    Source port: https (443)
    Destination port: 49697 (49697)
    [Stream index: 0]
    Sequence number: 1431    (relative sequence number)
    [Next sequence number: 2861    (relative sequence number)]
    Acknowledgment number: 168    (relative ack number)
    Header length: 20 bytes
    Flags: 0x010 (ACK)
        000. .... .... = Reserved: Not set
        ...0 .... .... = Nonce: Not set
        .... 0... .... = Congestion Window Reduced (CWR): Not set
        .... .0.. .... = ECN-Echo: Not set
        .... ..0. .... = Urgent: Not set
        .... ...1 .... = Acknowledgment: Set
        .... .... 0... = Push: Not set
        .... .... .0.. = Reset: Not set
        .... .... ..0. = Syn: Not set
        .... .... ...0 = Fin: Not set
    Window size value: 668
    [Calculated window size: 42752]
    [Window size scaling factor: 64]
    Checksum: 0xde8f [validation disabled]
        [Good Checksum: False]
        [Bad Checksum: False]
    [SEQ/ACK analysis]
        [Bytes in flight: 2860]
    [Reassembled PDU in frame: 9]
    TCP segment data (1430 bytes)

No.     Time           Source                Destination           Protocol Length Info
      8 0.016125000    192.168.1.104         74.125.225.112        TCP      54     49697 > https [ACK] Seq=168 Ack=2861 Win=65780 Len=0

Frame 8: 54 bytes on wire (432 bits), 54 bytes captured (432 bits) on interface 0
    Interface id: 0
    Encapsulation type: Ethernet (1)
    Arrival Time: Apr  7, 2014 17:26:52.879815000 Eastern Daylight Time
    [Time shift for this packet: 0.000000000 seconds]
    Epoch Time: 1396906012.879815000 seconds
    [Time delta from previous captured frame: 0.000022000 seconds]
    [Time delta from previous displayed frame: 0.000022000 seconds]
    [Time since reference or first frame: 0.016125000 seconds]
    Frame Number: 8
    Frame Length: 54 bytes (432 bits)
    Capture Length: 54 bytes (432 bits)
    [Frame is marked: False]
    [Frame is ignored: False]
    [Protocols in frame: eth:ip:tcp]
    [Coloring Rule Name: TCP]
    [Coloring Rule String: tcp]
Ethernet II, Src: Hewlett-_97:fd:09 (1c:c1:de:97:fd:09), Dst: Vmware_7f:e3:53 (00:0c:29:7f:e3:53)
    Destination: Vmware_7f:e3:53 (00:0c:29:7f:e3:53)
        Address: Vmware_7f:e3:53 (00:0c:29:7f:e3:53)
        .... ..0. .... .... .... .... = LG bit: Globally unique address (factory default)
        .... ...0 .... .... .... .... = IG bit: Individual address (unicast)
    Source: Hewlett-_97:fd:09 (1c:c1:de:97:fd:09)
        Address: Hewlett-_97:fd:09 (1c:c1:de:97:fd:09)
        .... ..0. .... .... .... .... = LG bit: Globally unique address (factory default)
        .... ...0 .... .... .... .... = IG bit: Individual address (unicast)
    Type: IP (0x0800)
Internet Protocol Version 4, Src: 192.168.1.104 (192.168.1.104), Dst: 74.125.225.112 (74.125.225.112)
    Version: 4
    Header length: 20 bytes
    Differentiated Services Field: 0x00 (DSCP 0x00: Default; ECN: 0x00: Not-ECT (Not ECN-Capable Transport))
        0000 00.. = Differentiated Services Codepoint: Default (0x00)
        .... ..00 = Explicit Congestion Notification: Not-ECT (Not ECN-Capable Transport) (0x00)
    Total Length: 40
    Identification: 0x4649 (17993)
    Flags: 0x02 (Don't Fragment)
        0... .... = Reserved bit: Not set
        .1.. .... = Don't fragment: Set
        ..0. .... = More fragments: Not set
    Fragment offset: 0
    Time to live: 128
    Protocol: TCP (6)
    Header checksum: 0xc688 [validation disabled]
        [Good: False]
        [Bad: False]
    Source: 192.168.1.104 (192.168.1.104)
    Destination: 74.125.225.112 (74.125.225.112)
    [Source GeoIP: Unknown]
    [Destination GeoIP: Unknown]
Transmission Control Protocol, Src Port: 49697 (49697), Dst Port: https (443), Seq: 168, Ack: 2861, Len: 0
    Source port: 49697 (49697)
    Destination port: https (443)
    [Stream index: 0]
    Sequence number: 168    (relative sequence number)
    Acknowledgment number: 2861    (relative ack number)
    Header length: 20 bytes
    Flags: 0x010 (ACK)
        000. .... .... = Reserved: Not set
        ...0 .... .... = Nonce: Not set
        .... 0... .... = Congestion Window Reduced (CWR): Not set
        .... .0.. .... = ECN-Echo: Not set
        .... ..0. .... = Urgent: Not set
        .... ...1 .... = Acknowledgment: Set
        .... .... 0... = Push: Not set
        .... .... .0.. = Reset: Not set
        .... .... ..0. = Syn: Not set
        .... .... ...0 = Fin: Not set
    Window size value: 16445
    [Calculated window size: 65780]
    [Window size scaling factor: 4]
    Checksum: 0xa64f [validation disabled]
        [Good Checksum: False]
        [Bad Checksum: False]
    [SEQ/ACK analysis]
        [This is an ACK to the segment in frame: 7]
        [The RTT to ACK the segment was: 0.000022000 seconds]

No.     Time           Source                Destination           Protocol Length Info
      9 0.016354000    74.125.225.112        192.168.1.104         TLSv1    705    Certificate

Frame 9: 705 bytes on wire (5640 bits), 705 bytes captured (5640 bits) on interface 0
    Interface id: 0
    Encapsulation type: Ethernet (1)
    Arrival Time: Apr  7, 2014 17:26:52.880044000 Eastern Daylight Time
    [Time shift for this packet: 0.000000000 seconds]
    Epoch Time: 1396906012.880044000 seconds
    [Time delta from previous captured frame: 0.000229000 seconds]
    [Time delta from previous displayed frame: 0.000229000 seconds]
